<?xml version="1.0" encoding="UTF-8"?>
<!DOCTYPE donhangs SYSTEM "donhang.dtd">
<donhangs xmlns:order="http://company.com/order" xmlns:prod="http://company.com/product">

    <order:donhang id="DH001" customer="Nguyễn Văn A" date="2025-09-15">
        <order:sanpham_list>
            <prod:sanpham id="SP001" quantity="2" price="15000000" />
            <prod:sanpham id="SP002" quantity="1" price="1200000" />
        </order:sanpham_list>
    </order:donhang>

    <order:donhang id="DH002" customer="Trần Thị B" date="2025-09-16">
        <order:sanpham_list>
            <prod:sanpham id="SP003" quantity="3" price="500000" />
            <prod:sanpham id="SP004" quantity="5" price="250000" />
        </order:sanpham_list>
    </order:donhang>

</donhangs>